<?xml version="1.0" encoding="UTF-8" ?>
<email xmlns:xsi="http://www.w3.org/2001/XMLSchema-instance"
  xsi:schemaLocation="https://docsoc.co.uk/xml/email email.xsd"
  logos="true" agenda="true" social="true">
  <heading>Something</heading>
  <text>
    Verbatim text
  </text>
  <event startDate="1970-01-01T00:00:00Z" endDate="2001-09-09T02:46:40+01:00" external="true">
    <image src="header image" />
    <!-- if a facebook tag is found, the facebook link will be the first link,
         it will also be the source for the text. Any further text is appended
         below. -->
    <facebook id="32849234" alias="optional alias link to be used in the text (not for sourcing)" />
    <facebook id="32849234" alias="optional alias link to be used in the text (not for sourcing)" />
    <links>
      <link href="link">Not Facebook</link>
    </links>
  </event>
  <sponsor company="bloomberg">
    Sponsor post
  </sponsor>
  <image width="100" src="link to image" alt="alt text" title="title" />
</email>
